11-12-2016 16:00	@TravelNewsBit	Travel + Adventure	"Centre, #Delhi #Government Quell #Rumours of #Salt: https://t.co/kxnp1g3feb, https://t.co/W5m180h8p9 https://t.co/WFDwBDRBCP"	7.98E+17	TravelAdventure	66	3	0	0	No	03-04-2016			View
11-12-2016 17:29	@PinkuSsac	मृगांक शर्मा	"RT @Being_Humor: Hi @MumbaiPolice #salt #rumours were spread by AAM AADMI PARTY Volunteer @sachintyagica. He tweeted to create chaos, later…"	7.98E+17	Twitter for Android	104	142	1479	0	No	06-01-2014	Jaipur	"Main Sanghi Hun. Please Congresses, Aapians & Secular Keep Proper Distance."	View
11-12-2016 17:38	@PavanEvergreen	Pavan Kumar	"RT @Being_Humor: Hi @MumbaiPolice #salt #rumours were spread by AAM AADMI PARTY Volunteer @sachintyagica. He tweeted to create chaos, later…"	7.98E+17	Twitter for Android	1108	2036	1479	0	No	22-09-2012	Ghaziabad	"A Proud https://t.co/csK0FrPGUP crazy fan. Follow me,Follow back jarur milega!! Baraaabarr milega!!"	View
11-12-2016 17:40	@AsiaNewsEye	Asia News	"Centre, #Delhi #Government Quell #Rumours of #Salt: https://t.co/X87vLPH7kV, https://t.co/eW1DK0nqzj https://t.co/6eJTDi61Kg"	7.98E+17	AsiaNews	5	1	0	0	No	21-07-2016			View
11-12-2016 17:40	@IndiaNewsEye	India news	"Centre, #Delhi #Government Quell #Rumours of #Salt: https://t.co/E0wd7e2SVo, https://t.co/zUNQcdiE3h https://t.co/UrdvAfcO6V"	7.98E+17	IndiaNewsNow	9	1	0	0	No	29-07-2016			View
11-12-2016 17:48	@being_pradipta	Pradipta	"RT @Being_Humor: Hi @MumbaiPolice #salt #rumours were spread by AAM AADMI PARTY Volunteer @sachintyagica. He tweeted to create chaos, later…"	7.98E+17	Twitter for Android	328	401	1479	0	No	27-12-2011	 india	A Proud Indian... A Fan of THE Salman Khan...	View
11-12-2016 17:57	@gauravindoriya	Gaurav Sharma	"RT @Being_Humor: Hi @MumbaiPolice #salt #rumours were spread by AAM AADMI PARTY Volunteer @sachintyagica. He tweeted to create chaos, later…"	7.98E+17	Twitter for Android	1193	179	1479	0	No	30-07-2011	गुलाबीशहर जयपुर..राजस्थान	Cricket is My first luv♡ Sachin♡ #RCB ♡King Virat Kohli♡ Akshay Kumar♡ ❤❤Queen Priyanka Chopra❤❤ ♡Megan Fox♡michelle Rodriguez♡ ♥Alexandra Daddario♥	View
